{
  "generated_at": "2026-05-08T13:58:00Z",
  "source": "metrodb.org",
  "city_count": 34,
  "no_daily_data_cities": [
    "changsha",
    "dalian",
    "dongguan",
    "hangzhou",
    "hohhot",
    "nanning",
    "nantong",
    "qingdao",
    "taiyuan",
    "wuhu",
    "wuxi"
  ],
  "items": [
    {
      "city": "beijing",
      "city_cn": "北京",
      "scrape_date": "2026-05-08",
      "operating_lines": 27,
      "lines_under_construction": 12,
      "operating_stations": 522,
      "operating_mileage_km": 861.0,
      "daily_ridership_wan": 1078.61,
      "ridership_intensity": 1.2527409988386,
      "peak_ridership_wan": 1380.78,
      "peak_ridership_date": "2018-08-17",
      "yearly_avg_ridership": {
        "years": [
          2018,
          2019,
          2020,
          2021,
          2022,
          2023,
          2024,
          2025,
          2026
        ],
        "values": [
          1068.8,
          1082.15,
          625.22,
          838.35,
          618.24,
          943.43,
          986.64,
          977.1,
          942.86
        ]
      }
    },
    {
      "city": "changchun",
      "city_cn": "长春",
      "scrape_date": "2026-05-08",
      "operating_lines": 6,
      "lines_under_construction": 5,
      "operating_stations": 100,
      "operating_mileage_km": 140.8,
      "daily_ridership_wan": 84.44,
      "ridership_intensity": 0.59971590909091,
      "peak_ridership_wan": 107.21,
      "peak_ridership_date": "2025-09-20",
      "yearly_avg_ridership": {
        "years": [
          2019,
          2020,
          2021,
          2022,
          2023,
          2024,
          2025,
          2026
        ],
        "values": [
          65.34,
          42.03,
          53.46,
          36.53,
          59.93,
          60.75,
          81.89,
          72.3
        ]
      }
    },
    {
      "city": "changsha",
      "city_cn": "长沙",
      "scrape_date": "2026-05-08",
      "operating_lines": 6,
      "lines_under_construction": 4,
      "operating_stations": 140,
      "operating_mileage_km": 218.28,
      "daily_ridership_wan": 0.0,
      "ridership_intensity": 0.0,
      "peak_ridership_wan": 467.5,
      "peak_ridership_date": "2025-12-31",
      "yearly_avg_ridership": {
        "years": [
          2018,
          2019,
          2020,
          2021,
          2022,
          2023,
          2024,
          2025,
          2026
        ],
        "values": [
          67.28,
          90.49,
          103.33,
          158.56,
          157.09,
          256.62,
          278.04,
          277.55,
          282.2
        ]
      }
    },
    {
      "city": "changzhou",
      "city_cn": "常州",
      "scrape_date": "2026-05-08",
      "operating_lines": 2,
      "lines_under_construction": 0,
      "operating_stations": 43,
      "operating_mileage_km": 53.99,
      "daily_ridership_wan": 18.91,
      "ridership_intensity": 0.35025004630487,
      "peak_ridership_wan": 42.88,
      "peak_ridership_date": "2026-04-11",
      "yearly_avg_ridership": {
        "years": [
          2019,
          2020,
          2021,
          2022,
          2023,
          2024,
          2025,
          2026
        ],
        "values": [
          16.75,
          6.53,
          13.16,
          12.29,
          20.03,
          19.7,
          20.3,
          21.02
        ]
      }
    },
    {
      "city": "chengdu",
      "city_cn": "成都",
      "scrape_date": "2026-05-08",
      "operating_lines": 15,
      "lines_under_construction": 7,
      "operating_stations": 388,
      "operating_mileage_km": 632.84,
      "daily_ridership_wan": 692.7,
      "ridership_intensity": 1.0945894696922,
      "peak_ridership_wan": 997.13,
      "peak_ridership_date": "2025-12-31",
      "yearly_avg_ridership": {
        "years": [
          2018,
          2019,
          2020,
          2021,
          2022,
          2023,
          2024,
          2025,
          2026
        ],
        "values": [
          316.89,
          382.98,
          331.05,
          489.3,
          427.53,
          577.44,
          600.25,
          613.97,
          643.21
        ]
      }
    },
    {
      "city": "chongqing",
      "city_cn": "重庆",
      "scrape_date": "2026-05-08",
      "operating_lines": 13,
      "lines_under_construction": 11,
      "operating_stations": 305,
      "operating_mileage_km": 522.54,
      "daily_ridership_wan": 416.1,
      "ridership_intensity": 0.79630267539327,
      "peak_ridership_wan": 615.0,
      "peak_ridership_date": "2025-12-31",
      "yearly_avg_ridership": {
        "years": [
          2018,
          2019,
          2020,
          2021,
          2022,
          2023,
          2024,
          2025,
          2026
        ],
        "values": [
          236.85,
          284.56,
          229.0,
          299.55,
          249.91,
          365.71,
          398.07,
          415.88,
          411.95
        ]
      }
    },
    {
      "city": "dalian",
      "city_cn": "大连",
      "scrape_date": "2026-05-08",
      "operating_lines": 5,
      "lines_under_construction": 2,
      "operating_stations": 79,
      "operating_mileage_km": 236.95,
      "daily_ridership_wan": 0.0,
      "ridership_intensity": 0.0,
      "peak_ridership_wan": 157.9,
      "peak_ridership_date": "2019-03-15",
      "yearly_avg_ridership": {
        "years": [
          2018,
          2019,
          2020,
          2021,
          2022,
          2023,
          2024,
          2025,
          2026
        ],
        "values": [
          48.44,
          56.86,
          34.29,
          42.66,
          39.46,
          66.29,
          73.41,
          71.84,
          66.03
        ]
      }
    },
    {
      "city": "dongguan",
      "city_cn": "东莞",
      "scrape_date": "2026-05-08",
      "operating_lines": 1,
      "lines_under_construction": 2,
      "operating_stations": 15,
      "operating_mileage_km": 37.79,
      "daily_ridership_wan": 0.0,
      "ridership_intensity": 0.0,
      "peak_ridership_wan": 65.0,
      "peak_ridership_date": "2026-01-01",
      "yearly_avg_ridership": {
        "years": [
          2018,
          2019,
          2020,
          2021,
          2022,
          2023,
          2024,
          2025,
          2026
        ],
        "values": [
          13.0,
          14.75,
          9.75,
          11.15,
          8.98,
          12.42,
          13.51,
          14.15,
          53.96
        ]
      }
    },
    {
      "city": "guangzhou",
      "city_cn": "广州",
      "scrape_date": "2026-05-08",
      "operating_lines": 15,
      "lines_under_construction": 11,
      "operating_stations": 290,
      "operating_mileage_km": 662.58,
      "daily_ridership_wan": 967.3,
      "ridership_intensity": 1.4598991819856,
      "peak_ridership_wan": 1409.32,
      "peak_ridership_date": "2025-12-31",
      "yearly_avg_ridership": {
        "years": [
          2018,
          2019,
          2020,
          2021,
          2022,
          2023,
          2024,
          2025,
          2026
        ],
        "values": [
          829.06,
          905.72,
          659.16,
          776.43,
          646.01,
          857.24,
          887.93,
          931.23,
          934.28
        ]
      }
    },
    {
      "city": "guiyang",
      "city_cn": "贵阳",
      "scrape_date": "2026-05-08",
      "operating_lines": 2,
      "lines_under_construction": 3,
      "operating_stations": 57,
      "operating_mileage_km": 118.73,
      "daily_ridership_wan": 74.29,
      "ridership_intensity": 0.62570538195907,
      "peak_ridership_wan": 143.01,
      "peak_ridership_date": "2025-12-31",
      "yearly_avg_ridership": {
        "years": [
          2018,
          2019,
          2020,
          2021,
          2022,
          2023,
          2024,
          2025,
          2026
        ],
        "values": [
          15.18,
          14.92,
          12.21,
          29.52,
          25.49,
          36.67,
          69.46,
          78.3,
          73.76
        ]
      }
    },
    {
      "city": "hangzhou",
      "city_cn": "杭州",
      "scrape_date": "2026-05-08",
      "operating_lines": 11,
      "lines_under_construction": 4,
      "operating_stations": 241,
      "operating_mileage_km": 516.0,
      "daily_ridership_wan": 0.0,
      "ridership_intensity": 0.0,
      "peak_ridership_wan": 581.58,
      "peak_ridership_date": "2025-12-31",
      "yearly_avg_ridership": {
        "years": [
          2018,
          2019,
          2020,
          2021,
          2022,
          2023,
          2024,
          2025,
          2026
        ],
        "values": [
          145.17,
          173.71,
          97.09,
          243.27,
          347.45,
          297.93,
          330.05,
          423.52,
          501.07
        ]
      }
    },
    {
      "city": "harbin",
      "city_cn": "哈尔滨",
      "scrape_date": "2026-05-08",
      "operating_lines": 3,
      "lines_under_construction": 1,
      "operating_stations": 78,
      "operating_mileage_km": 91.57,
      "daily_ridership_wan": 110.76,
      "ridership_intensity": 1.2095664518947,
      "peak_ridership_wan": 173.0,
      "peak_ridership_date": "2024-12-31",
      "yearly_avg_ridership": {
        "years": [
          2018,
          2019,
          2020,
          2021,
          2022,
          2023,
          2024,
          2025,
          2026
        ],
        "values": [
          22.38,
          28.4,
          14.09,
          19.75,
          38.85,
          77.07,
          98.74,
          114.04,
          109.91
        ]
      }
    },
    {
      "city": "hefei",
      "city_cn": "合肥",
      "scrape_date": "2026-05-08",
      "operating_lines": 6,
      "lines_under_construction": 3,
      "operating_stations": 161,
      "operating_mileage_km": 232.1,
      "daily_ridership_wan": 178.8,
      "ridership_intensity": 0.77035760448083,